{
  "fixed_test_run_id": "exploratory_multi_iw_v1",
  "run_id": "exploratory_multi_iw_v1",
  "attempt_id": "attempt_20260507_122945",
  "generated_at": "2026-05-07T12:32:15.521672+08:00",
  "candidate_scheme_id": "multi_ic_weighted_v1",
  "research_round_id": "rr_exploratory_multi_signal_composite_20260506",
  "benchmark_contribution_total": 2.6183351305800753,
  "cash_drag_total": -2.175949352247617,
  "selection_alpha_total": 1.6797754420235396,
  "low_liquidity_contribution_total": 0.305198338709304
}
