{
  "fixed_test_run_id": "exploratory_power_inv_rev_a6_v1",
  "run_id": "exploratory_power_inv_rev_a6_v1",
  "attempt_id": "attempt_20260506_153517",
  "generated_at": "2026-05-06T15:37:47.372142+08:00",
  "candidate_scheme_id": "power_inv_rev_a6_v1",
  "research_round_id": "rr_exploratory_power_transform_reversal_20260506",
  "benchmark_contribution_total": 2.6183351305800753,
  "cash_drag_total": -2.270035011503619,
  "selection_alpha_total": -0.7798118261767322,
  "low_liquidity_contribution_total": -0.5903173654081427
}
