{
  "fixed_test_run_id": "ft_c4_drop_liq_trend_20260429",
  "run_id": "confirmatory_baseline_v1_trainval_20260429",
  "attempt_id": "attempt_20260429_145805",
  "generated_at": "2026-04-29T15:02:23.477764+08:00",
  "candidate_scheme_id": "confirmatory_ablation_drop_liq_trend_3sig",
  "research_round_id": "rr_confirmatory_c4_ablation_mid_20260429",
  "benchmark_contribution_total": 2.6183351305800753,
  "cash_drag_total": -0.8998759306918225,
  "selection_alpha_total": 4.699179062328729,
  "low_liquidity_contribution_total": 0.5461069066350837
}
