{
  "fixed_test_run_id": "exploratory_reversal_p98_top12_trainval_20260506",
  "run_id": "exploratory_reversal_p98_top12_trainval_20260506",
  "attempt_id": "attempt_20260506_124943",
  "generated_at": "2026-05-06T12:52:27.134277+08:00",
  "candidate_scheme_id": "reversal_tail_exclude_p98_top12_v1",
  "research_round_id": "rr_exploratory_reversal_p98_top12_20260506",
  "benchmark_contribution_total": 2.6183351305800753,
  "cash_drag_total": -2.1585415323654,
  "selection_alpha_total": 1.3948968647343563,
  "low_liquidity_contribution_total": 0.17755938450007522
}
