{
  "fixed_test_run_id": "diag_oracle_5d_return",
  "run_id": "diag_oracle_5d_return",
  "attempt_id": "attempt_20260502_002223",
  "generated_at": "2026-05-02T00:24:54.565537+08:00",
  "candidate_scheme_id": "diag_oracle_5d_return",
  "research_round_id": "diag_perfect_foresight_stress_probe_20260501",
  "benchmark_contribution_total": 2.618335130580075,
  "cash_drag_total": -1.6650676470176964,
  "selection_alpha_total": 99.22469676523411,
  "low_liquidity_contribution_total": 9.780462323036236
}
