{
  "fixed_test_run_id": "ft_c2_drop_upside_share_20260429",
  "run_id": "confirmatory_baseline_v1_trainval_20260429",
  "attempt_id": "attempt_20260429_142738",
  "generated_at": "2026-04-29T14:33:48.191253+08:00",
  "candidate_scheme_id": "confirmatory_ablation_drop_upside_range_share_4sig",
  "research_round_id": "rr_confirmatory_c2_ablation_20260429",
  "benchmark_contribution_total": 2.618335130580075,
  "cash_drag_total": -0.9698556188531029,
  "selection_alpha_total": 5.450693138085501,
  "low_liquidity_contribution_total": 0.9074375936282926
}
